{
  "event_id": "evt_variables_123",
  "event_type": "variables.ready",
  "version": 1,
  "occurred_at": "2026-05-01T10:04:00Z",
  "correlation_id": "corr_123",
  "producer": "variable-registry-service",
  "client_id": "client_123",
  "competence_id": "competence_2026_05",
  "payload": { "variable_count": 148 }
}
