{
  "event_id": "evt_confirmed_123",
  "event_type": "document.confirmed",
  "version": 1,
  "occurred_at": "2026-05-01T10:02:00Z",
  "correlation_id": "corr_123",
  "causation_id": "evt_classified_123",
  "producer": "document-classification-service",
  "client_id": "client_123",
  "competence_id": "competence_2026_05",
  "document_id": "doc_123",
  "payload": { "confirmed_by": "user_123" }
}
